<?xml version="1.0" encoding="UTF-8"?>
<BookStore  xmlns:xsi="http://www.w3.org/2001/XMLSchema-instance" xsi:noNamespaceSchemaLocation="file:///G:/FrontEnd/New%20folder/CourseContent/Day2%20-XMLSchema/MobileUI/demo1.xsd">

 <Book>
	<Title>String</Title>
	<Author>String</Author>
	<date>String</date>
	<ISBN>String</ISBN>
	<Publisher>String</Publisher>
</Book>
<Book>
	<Title>String</Title>
	<Author>String</Author>
	<date>String</date>
	<ISBN>String</ISBN>
	<Publisher>String</Publisher>
</Book>
</BookStore>








